{
  "$schema": "https://json-schema.org/draft/2020-12/schema",
  "$id": "https://claire-de-binare/docs/contracts/profitability_execution_economics_assessment.v1.schema.json",
  "title": "Profitability Execution Economics Assessment v1",
  "type": "object",
  "additionalProperties": false,
  "required": [
    "schema_version",
    "assessment_id",
    "candidate_id",
    "model_id",
    "generated_at",
    "gross_return",
    "net_return",
    "cost_breakdown",
    "assessment_status",
    "ranking_ready",
    "assumption_findings",
    "limitations"
  ],
  "properties": {
    "schema_version": {
      "const": "profitability_execution_economics_assessment.v1"
    },
    "assessment_id": {
      "type": "string",
      "pattern": "^peea-[a-z0-9_-]{6,64}$"
    },
    "candidate_id": {
      "type": "string",
      "pattern": "^cand-[a-z0-9_-]{4,64}$"
    },
    "model_id": {
      "type": "string",
      "pattern": "^peem-[a-z0-9_-]{6,64}$"
    },
    "generated_at": {
      "type": "string",
      "format": "date-time"
    },
    "gross_return": {
      "type": "number"
    },
    "net_return": {
      "type": "number"
    },
    "cost_breakdown": {
      "type": "object",
      "additionalProperties": false,
      "required": [
        "fees",
        "spread_cost",
        "slippage_cost",
        "other_friction_cost",
        "total_cost"
      ],
      "properties": {
        "fees": {
          "type": "number",
          "minimum": 0.0
        },
        "spread_cost": {
          "type": "number",
          "minimum": 0.0
        },
        "slippage_cost": {
          "type": "number",
          "minimum": 0.0
        },
        "other_friction_cost": {
          "type": "number",
          "minimum": 0.0
        },
        "total_cost": {
          "type": "number",
          "minimum": 0.0
        }
      }
    },
    "assessment_status": {
      "type": "string",
      "enum": ["PASS", "WARNING", "FAIL", "BLOCKED"]
    },
    "ranking_ready": {
      "type": "boolean"
    },
    "assumption_findings": {
      "type": "array",
      "items": {
        "type": "object",
        "additionalProperties": false,
        "required": [
          "category",
          "severity",
          "summary"
        ],
        "properties": {
          "category": {
            "type": "string",
            "enum": ["FEE", "SPREAD", "SLIPPAGE", "ATTRIBUTION", "DATA_GAP"]
          },
          "severity": {
            "type": "string",
            "enum": ["INFO", "WARNING", "FAIL", "BLOCKED"]
          },
          "summary": {
            "type": "string",
            "minLength": 1
          }
        }
      }
    },
    "limitations": {
      "type": "array",
      "minItems": 1,
      "items": {
        "type": "string",
        "minLength": 1
      }
    }
  }
}
